id,title,firstname,lastname,email,country,other_authors,comment,appearance_date,created_at
875,Cumque accusantium dignissimos eaque.,Stefan,Prohaska,wade@gislason.co,CH,Kari Gusikowski Ret.,Porro quam ipsum sit expedita magni.,2022-04-29,2022-04-29 16:00:46 UTC
884,Impedit voluptatum ipsam beatae dolorum.,Iesha,Kulas,jenelle@schowalter-abbott.name,CH,Katelynn Bergstrom,At velit doloremque sapiente.,2022-04-29,2022-04-29 16:00:46 UTC
876,Iste rerum eum atque consequatur veniam.,Tracy,Grant,abby@bosco.info,CH,Lynsey Mosciski,Nemo aut labore consequatur.,2022-04-29,2022-04-29 16:00:46 UTC
877,Inventore quaerat sunt reprehenderit.,Bong,Brown,isaiah@rempel.biz,CH,Fredia Mills,Et qui non aliquid et.,2022-04-29,2022-04-29 16:00:46 UTC
878,Quia laborum aut dicta consectetur quod.,Crissy,Quigley,denae_terry@morissette-hessel.name,CH,Gov. Kendra Crona,Enim veritatis occaecati.,2022-04-29,2022-04-29 16:00:46 UTC
885,Sint distinctio sequi.,Catherine,Zboncak,markus.mclaughlin@mante.info,CH,Clorinda McLaughlin,Beatae repudiandae dolorum.,2022-04-29,2022-04-29 16:00:46 UTC
879,Et repellendus accusamus suscipit iure.,Mariah,Mayer,jillian@gislason.org,CH,Cornelius Murray,Culpa facere a reprehenderit commodi.,2022-04-29,2022-04-29 16:00:46 UTC
880,Laborum possimus consectetur.,Nicky,Bode,ethel_beahan@purdy.net,CH,Laverne Hane,Rem laudantium et.,2022-04-29,2022-04-29 16:00:46 UTC
890,Sunt rerum ut minima eos maxime.,Kaley,Herzog,millard.bogan@murphy.biz,CH,Fr. Moshe Schaefer,Dolor a atque.,2022-04-29,2022-04-29 16:00:47 UTC
881,Nihil debitis et adipisci at laboriosam.,Megan,Harris,ramon@pollich-gorczany.biz,CH,Jamal Moore,Et soluta qui.,2022-04-29,2022-04-29 16:00:46 UTC
886,In nisi dolorem et.,Mohammad,Brown,arlen.kautzer@schuppe.com,CH,Mack Kerluke,Repellat excepturi similique.,2022-04-29,2022-04-29 16:00:46 UTC
873,Aliquid similique qui fuga animi voluptatum.,Isaias,Gerlach,deeann_steuber@skiles.com,CH,Ginger Dickens,Totam quibusdam nam ratione.,2022-04-29,2022-04-29 16:00:46 UTC
882,Enim atque quibusdam libero animi sit.,Evan,Jakubowski,murray.zulauf@cartwright.net,CH,Rae Gulgowski,Porro nemo tempore illum facilis ex.,2022-04-29,2022-04-29 16:00:46 UTC
874,Rerum magnam eos ipsa.,Bud,O'Hara,brittany_bayer@torp.co,CH,Carlota Lockman,Aliquid impedit exercitationem alias consequatur.,2022-04-29,2022-04-29 16:00:46 UTC
883,Nihil aut delectus.,Curtis,Johns,bobby.abernathy@towne.io,CH,Harold Kuhic,Tempore eius optio.,2022-04-29,2022-04-29 16:00:46 UTC
887,Ut odit itaque necessitatibus aliquid.,Stanley,Jaskolski,vikki_hilpert@goodwin.info,CH,Elodia Gutmann,Dolor quia et autem repudiandae.,2022-04-29,2022-04-29 16:00:46 UTC
888,Aut nostrum repellat assumenda asperiores sunt.,Emma,McLaughlin,jimmie@kilback.io,CH,Yen McCullough,Molestiae cupiditate cumque.,2022-04-29,2022-04-29 16:00:46 UTC
891,Qui velit aliquam maxime maiores.,Gene,Larson,roy.gottlieb@kerluke.info,CH,Wilton Schroeder LLD,Non itaque vel enim est.,2022-04-29,2022-04-29 16:00:47 UTC
889,Libero voluptatibus qui eveniet et.,Marti,Mitchell,amanda_roberts@zemlak-kutch.co,CH,Kip Wisozk,Laborum corporis sequi saepe.,2022-04-29,2022-04-29 16:00:46 UTC
892,Iure id culpa autem.,Alma,Kuhlman,carmine.mraz@hamill-walsh.name,CH,Carroll Tremblay,Consectetur ut repellendus.,2022-04-29,2022-04-29 16:00:47 UTC
