id,title,firstname,lastname,email,country,other_authors,comment,appearance_date,created_at
264,Blanditiis qui eos odio asperiores.,Ceola,Kirlin,herb@mclaughlin.io,CH,Dovie Ernser,Quia ipsum deserunt qui molestiae.,2022-04-30,2022-04-30 18:46:47 UTC
273,Itaque ab a.,Hank,Auer,mariah@haley.info,CH,Marissa Anderson,Quibusdam totam qui perspiciatis temporibus.,2022-04-30,2022-04-30 18:46:48 UTC
265,Et enim voluptas.,Meggan,Hyatt,terra.strosin@watsica.co,CH,Noella Block,Deserunt aspernatur adipisci eveniet aut minus.,2022-04-30,2022-04-30 18:46:47 UTC
266,Facere vel ut soluta praesentium.,Evalyn,D'Amore,albina@reilly.biz,CH,Sydney Steuber DC,Odio sint in omnis.,2022-04-30,2022-04-30 18:46:48 UTC
279,Iure deserunt iusto explicabo nesciunt eius.,Maxima,Leuschke,ronald.welch@paucek.com,CH,Pres. Sha Hettinger,Non sit harum doloremque.,2022-04-30,2022-04-30 18:46:49 UTC
267,Nobis commodi voluptas saepe.,Johana,Marvin,rodrigo@kirlin.net,CH,Burt Huel,Cum nisi quia ut ut.,2022-04-30,2022-04-30 18:46:48 UTC
274,Quibusdam iure quia possimus ut.,Mckinley,Schmitt,magda@legros.io,CH,Harry Bernhard,Ut veniam culpa.,2022-04-30,2022-04-30 18:46:48 UTC
268,Ut est autem saepe qui animi.,Jamie,Stark,kimiko@schoen.net,CH,Trevor Miller,Ipsum et in dolores voluptas.,2022-04-30,2022-04-30 18:46:48 UTC
269,Aut id esse.,Cristen,Mayert,ariel.boyle@kuvalis-hauck.info,CH,Aurora Morissette,Inventore illo laborum rem.,2022-04-30,2022-04-30 18:46:48 UTC
270,Reiciendis inventore laboriosam et.,Jaye,Purdy,porfirio.rath@gulgowski.biz,CH,Lasandra Dach,Cupiditate id corrupti sed voluptatem.,2022-04-30,2022-04-30 18:46:48 UTC
275,Consequatur voluptatem deserunt itaque quo.,Brandon,Koss,lorinda@gorczany.io,CH,Prof. Claudio Stroman,Quis ullam asperiores nobis.,2022-04-30,2022-04-30 18:46:48 UTC
271,Consequatur perferendis expedita harum repudiandae.,Ming,Dietrich,nell@lynch.co,CH,Lucius Leuschke CPA,Rerum dolore ipsa suscipit.,2022-04-30,2022-04-30 18:46:48 UTC
262,Veritatis voluptas modi.,Dorine,Wiegand,randi@dach.co,CH,Clayton Kohler,Iste omnis labore qui.,2022-04-30,2022-04-30 18:46:47 UTC
263,Laboriosam explicabo illo voluptas ut.,Contessa,Sipes,stephen.halvorson@rippin.co,CH,Arron Abshire,Qui eum est expedita iste.,2022-04-30,2022-04-30 18:46:47 UTC
272,Laudantium iste porro laboriosam doloremque.,Fredric,Berge,miguelina@treutel.biz,CH,Many Sipes,Quaerat voluptatem itaque rerum natus commodi.,2022-04-30,2022-04-30 18:46:48 UTC
276,Quo maiores quis aut accusantium.,Victor,Ullrich,billye@boehm.com,CH,Kris Sporer,Similique et earum corporis ipsam error.,2022-04-30,2022-04-30 18:46:48 UTC
280,Exercitationem ea cum tempora unde.,Samuel,Mohr,taryn@terry.name,CH,Isela Breitenberg,Nisi voluptate asperiores officiis possimus.,2022-04-30,2022-04-30 18:46:49 UTC
277,Adipisci dolor vitae maxime provident.,Gary,Kuhic,julieta.mueller@trantow.net,CH,Romeo Pacocha IV,Id officiis dicta.,2022-04-30,2022-04-30 18:46:48 UTC
278,Molestiae dicta minus quia rem consequuntur.,Janee,Kutch,lesley.greenfelder@ryan.co,CH,Troy Satterfield,Iste necessitatibus inventore consectetur.,2022-04-30,2022-04-30 18:46:49 UTC
281,Harum est autem impedit.,Jerold,Trantow,annetta@christiansen.net,CH,Eun Mayer,Aspernatur ullam laudantium nulla nesciunt.,2022-04-30,2022-04-30 18:46:49 UTC
