id,title,firstname,lastname,email,country,other_authors,comment,appearance_date,created_at
1496,Esse id qui.,Garry,Lueilwitz,joya_streich@graham.co,CH,Margit Hintz,Ipsum impedit ratione accusantium veniam.,2021-10-04,2021-10-04 13:18:48 UTC
1486,Fuga perspiciatis deserunt impedit.,Jamaal,Nitzsche,meagan@conn.info,CH,Terrence Aufderhar,Aut et ex necessitatibus doloribus beatae.,2021-10-04,2021-10-04 13:18:47 UTC
1487,Repudiandae fugiat eum.,Thu,McGlynn,minerva@thiel.io,CH,Dr. Fermin Walter,Ut eum beatae reiciendis quaerat.,2021-10-04,2021-10-04 13:18:47 UTC
1488,Veniam consectetur et maiores.,Winford,Koepp,lashanda_kohler@greenfelder.org,CH,Pres. Barbara Schultz,Rerum ipsum esse consequatur aperiam reprehenderit.,2021-10-04,2021-10-04 13:18:47 UTC
1497,Sit ut voluptatem error eius dignissimos.,Mac,Koch,graig_towne@quigley.io,CH,Gov. Jame Turcotte,Eligendi doloribus minus vel.,2021-10-04,2021-10-04 13:18:48 UTC
1489,Qui iusto praesentium aliquam placeat.,Mica,Blanda,britni@witting.biz,CH,Afton Pacocha,Dolor beatae reiciendis est voluptate.,2021-10-04,2021-10-04 13:18:47 UTC
1490,Inventore voluptatum deleniti.,Lauri,Halvorson,kerry.dicki@marvin.com,CH,Hedwig Ferry,Sed neque laborum.,2021-10-04,2021-10-04 13:18:47 UTC
1503,Quam cumque atque non.,Chet,Schmidt,novella@turcotte.com,CH,Parker Stiedemann,Et corporis ut enim.,2021-10-04,2021-10-04 13:18:48 UTC
1491,Dolorem nesciunt debitis ex tempore sit.,Fritz,Osinski,tyson@upton.io,CH,Rev. Florencia Ferry,Dolores vel iure quibusdam ducimus.,2021-10-04,2021-10-04 13:18:47 UTC
1498,Maxime consequatur qui a.,Lekisha,Windler,bruce@torp-raynor.org,CH,Cyndy Wiegand,Quo deserunt provident accusamus nulla laboriosam.,2021-10-04,2021-10-04 13:18:48 UTC
1492,Harum a quia laudantium.,Edmund,Skiles,stephan_gottlieb@wolff.org,CH,Ms. Jc Macejkovic,Doloremque quas illum.,2021-10-04,2021-10-04 13:18:47 UTC
1493,Neque qui ipsam nostrum ut.,Josiah,Stracke,lyndon@muller-schmitt.net,CH,Andres Nader,Sit incidunt non aspernatur.,2021-10-04,2021-10-04 13:18:47 UTC
1485,Et vel aliquam sequi.,Susie,Johnson,ardath_windler@hane.biz,CH,Clyde Ryan,Et aut aut.,2021-10-04,2021-10-04 13:18:47 UTC
1494,Aut laboriosam similique accusantium voluptate.,Pearline,Wyman,nubia@cruickshank-wolf.name,CH,Shantay Crooks,Consequuntur ut nobis.,2021-10-04,2021-10-04 13:18:48 UTC
1499,Accusamus exercitationem quibusdam beatae cupiditate.,Lovetta,Reilly,dan@will.co,CH,Dede Kovacek,Nihil quaerat laborum.,2021-10-04,2021-10-04 13:18:48 UTC
1495,Dolorum neque eveniet aut.,Bok,Ward,gaston_conroy@crist.org,CH,Fr. Geraldine Towne,Ea id et.,2021-10-04,2021-10-04 13:18:48 UTC
1504,Omnis vero sunt eos aliquid facilis.,Raymon,Schuster,adah@bode.org,CH,Bertram Roberts,Rem similique magni qui eveniet.,2021-10-04,2021-10-04 13:18:48 UTC
1500,Itaque rerum et suscipit.,Gus,Ward,emile.reynolds@funk-becker.net,CH,Edwin Kertzmann IV,Est temporibus deleniti enim laborum.,2021-10-04,2021-10-04 13:18:48 UTC
1501,Nesciunt consequatur quis est.,Dominic,Johns,sheldon_langworth@boehm.co,CH,Ms. Arturo Walter,Ipsa consequatur error dolores beatae.,2021-10-04,2021-10-04 13:18:48 UTC
1502,Autem excepturi perspiciatis.,Delbert,Fritsch,lennie_deckow@moore.name,CH,Aurelia Pacocha,Sit nemo possimus deserunt accusamus aut.,2021-10-04,2021-10-04 13:18:48 UTC
