id,title,firstname,lastname,email,country,other_authors,comment,appearance_date,created_at
213,Praesentium beatae aliquid magnam deleniti.,Everett,Koch,kristi@jaskolski.net,CH,Fr. Jerry O'Kon,Ipsa ipsum adipisci tempore.,2022-07-30,2022-07-30 17:43:53 UTC
220,Id dolorem sed vitae quis nobis.,Jaclyn,Schmitt,morris@murphy.io,CH,Donny Schimmel,Labore non dolore.,2022-07-30,2022-07-30 17:43:53 UTC
214,Qui excepturi et nemo sunt ut.,Chassidy,O'Conner,karri@lind-jacobs.info,CH,Tasha Volkman,Aspernatur magnam minima adipisci atque distinctio.,2022-07-30,2022-07-30 17:43:53 UTC
215,Odit voluptas delectus.,Saran,Reichert,wayne@bogan.org,CH,Adrian McClure,Assumenda ipsam et vero.,2022-07-30,2022-07-30 17:43:53 UTC
227,Enim nemo maiores saepe.,Jefferson,O'Hara,christian_becker@bogan.info,CH,Hal Nikolaus,Iusto rem et laudantium autem et.,2022-07-30,2022-07-30 17:43:53 UTC
216,Nam mollitia blanditiis iusto.,Kiley,Dickens,terra@deckow-schuppe.io,CH,Keturah Lynch,Dolore debitis optio repudiandae quia.,2022-07-30,2022-07-30 17:43:53 UTC
221,Delectus vel qui.,Nita,Veum,carey_wisozk@hintz.io,CH,Amb. Klara Goldner,Voluptas aperiam aspernatur error dolor voluptas.,2022-07-30,2022-07-30 17:43:53 UTC
217,Ut est mollitia a qui.,Jesse,Hirthe,scott.stark@dietrich.co,CH,Theresa Welch,Tenetur molestiae nobis.,2022-07-30,2022-07-30 17:43:53 UTC
218,Expedita eveniet rerum enim.,Romeo,Adams,darryl_orn@mcclure.com,CH,Msgr. Archie Medhurst,Tenetur fuga necessitatibus voluptas nemo qui.,2022-07-30,2022-07-30 17:43:53 UTC
225,Est dignissimos laboriosam rem praesentium aperiam.,Korey,Boehm,donn.turner@macgyver.net,CH,Lewis Wisoky JD,Consequuntur blanditiis quam cupiditate repellendus quasi.,2022-07-30,2022-07-30 17:43:53 UTC
219,Modi facilis nemo excepturi.,Evelina,Bins,salena.stokes@emard-paucek.biz,CH,Saul Doyle,Aliquid numquam fugiat.,2022-07-30,2022-07-30 17:43:53 UTC
222,Exercitationem aut laboriosam sapiente aut dolores.,Dannie,Pfeffer,willow@spinka-rempel.org,CH,Jeramy Bradtke,Pariatur sint temporibus quam.,2022-07-30,2022-07-30 17:43:53 UTC
223,Sint non iste esse rem excepturi.,Norbert,Larson,oleta@dooley-yundt.biz,CH,Kelvin Lang,Id facilis eos ut voluptas.,2022-07-30,2022-07-30 17:43:53 UTC
224,Unde corporis est eos.,Loura,Moore,pat@kunze-rodriguez.net,CH,Amb. Lavada Reinger,Minus omnis quo.,2022-07-30,2022-07-30 17:43:53 UTC
226,Maiores culpa rerum omnis.,Fermin,Welch,ronny@hane.io,CH,Miss Huey Dickinson,Assumenda exercitationem quis optio excepturi voluptas.,2022-07-30,2022-07-30 17:43:53 UTC
230,Amet illum est sit non molestiae.,Vickie,Walker,sanora@turcotte-reilly.org,CH,Marylyn Jenkins,Dolores assumenda est maxime aut molestias.,2022-07-30,2022-07-30 17:43:53 UTC
229,Iure enim laudantium perferendis et et.,Sandy,Koepp,roxana@rice.com,CH,Sydney Keeling,Minima quisquam corporis doloribus.,2022-07-30,2022-07-30 17:43:53 UTC
228,Sed et ad dolor.,Albertine,McClure,loren@fay.info,CH,Kerry Adams III,Sequi autem perferendis minima sint et.,2022-07-30,2022-07-30 17:43:53 UTC
231,Quia repudiandae harum.,Lasonya,Yundt,marvin.crooks@simonis.org,CH,Mr. Maynard Greenholt,Laudantium itaque nostrum nobis autem alias.,2022-07-30,2022-07-30 17:43:53 UTC
232,Dignissimos placeat voluptas assumenda.,Brenton,Bernhard,mckenzie@farrell-harris.net,CH,Sen. Maynard Jacobs,Dolorem asperiores officiis mollitia.,2022-07-30,2022-07-30 17:43:53 UTC
