id,title,firstname,lastname,email,country,other_authors,comment,appearance_date,created_at
263,Sit perspiciatis voluptate excepturi est quia.,Sol,Schamberger,julio@monahan-dietrich.info,CH,Caprice Reilly,Sunt blanditiis aperiam perspiciatis.,2022-07-05,2022-07-05 09:55:08 UTC
250,Ut et voluptatum cupiditate.,Hwa,Ziemann,katie_gulgowski@brekke.com,CH,Miss Elton Lakin,Minus ipsum id perspiciatis sapiente laboriosam.,2022-07-05,2022-07-05 09:55:08 UTC
244,Et aspernatur assumenda sit ut.,Ludie,Christiansen,delsie.oberbrunner@brown-hamill.org,CH,Stewart Johnson,Nemo illum non.,2022-07-05,2022-07-05 09:55:08 UTC
245,Omnis ut occaecati natus eum.,Gayle,Schaden,chloe_wolf@kassulke.info,CH,Rolf Luettgen,Fugiat ipsam voluptas odit.,2022-07-05,2022-07-05 09:55:08 UTC
254,Ut tempore explicabo quisquam.,Izetta,Lynch,agustin_mertz@rutherford-schinner.io,CH,Nina Fay,Reprehenderit dignissimos facere animi tempora.,2022-07-05,2022-07-05 09:55:08 UTC
246,Dicta molestiae sunt rem vel aperiam.,Jessenia,Hane,beatrice_harvey@fisher-mcglynn.name,CH,Kris Wiza,Quibusdam voluptatem magnam et inventore beatae.,2022-07-05,2022-07-05 09:55:08 UTC
251,Repudiandae autem nostrum ut velit.,Wenona,Robel,chau@mayert-prosacco.net,CH,Teodoro Labadie Esq.,Nihil consequatur temporibus sint beatae.,2022-07-05,2022-07-05 09:55:08 UTC
247,Amet aut qui ipsam repellendus.,Delaine,Schmitt,emogene_gusikowski@kiehn-oreilly.co,CH,Timothy Champlin,Quisquam eum ab dicta rerum.,2022-07-05,2022-07-05 09:55:08 UTC
248,Nulla tempore consectetur quia molestiae.,Katelin,Rosenbaum,jess@pfeffer.co,CH,Liane Schulist,Provident vitae officiis.,2022-07-05,2022-07-05 09:55:08 UTC
249,Omnis placeat temporibus earum itaque laudantium.,Hiroko,Wunsch,georgeann@stoltenberg-gottlieb.com,CH,Jonnie O'Conner DDS,Sed facilis ut nihil id.,2022-07-05,2022-07-05 09:55:08 UTC
260,Soluta est quisquam ex cum.,Florencio,Borer,lazaro@mckenzie.org,CH,Aurora Reynolds,Sint est placeat.,2022-07-05,2022-07-05 09:55:08 UTC
252,Accusantium maxime ea iusto.,Robin,Gorczany,boyd.rau@kiehn.net,CH,Sen. Violeta Tremblay,Repellat quam tempore minus.,2022-07-05,2022-07-05 09:55:08 UTC
255,Quo et non.,Laurence,Raynor,debrah@olson.name,CH,Christian Wunsch Ret.,Vel adipisci porro officiis impedit dignissimos.,2022-07-05,2022-07-05 09:55:08 UTC
253,Voluptatum rerum deleniti officia.,Arielle,Wilderman,anja_jast@lind-brakus.net,CH,Meghan Feeney DO,Omnis quis id consequatur.,2022-07-05,2022-07-05 09:55:08 UTC
257,Eveniet velit omnis iure ipsum reprehenderit.,Collen,Price,gertha.nienow@franecki-durgan.io,CH,Jerrod Dare,Veniam quis reprehenderit officia nostrum.,2022-07-05,2022-07-05 09:55:08 UTC
256,Odio non sed id.,Elva,Auer,chandra@dooley-schulist.co,CH,Rev. Toby McKenzie,Et qui non voluptatem quam dolorum.,2022-07-05,2022-07-05 09:55:08 UTC
259,Vero est est eligendi expedita.,Kia,Quitzon,bennett@blanda.net,CH,The Hon. Hoa Abernathy,Laudantium ut quia voluptas enim.,2022-07-05,2022-07-05 09:55:08 UTC
258,Sint aut sit aliquid iusto at.,Edwardo,Harvey,gil_ohara@thiel.io,CH,Tasia Mraz V,Fuga voluptates consequatur autem quia voluptatibus.,2022-07-05,2022-07-05 09:55:08 UTC
261,Nobis velit reiciendis quaerat est.,Ronny,Jast,hortencia.mueller@bashirian.org,CH,Pres. Latricia Gerhold,Voluptate cum quidem excepturi.,2022-07-05,2022-07-05 09:55:08 UTC
262,Quia sed voluptas expedita.,Elfriede,Ullrich,darnell@erdman.net,CH,Irwin Predovic,Aut ipsum sit soluta.,2022-07-05,2022-07-05 09:55:08 UTC
