id,title,firstname,lastname,email,country,other_authors,comment,appearance_date,created_at
557,Omnis ut quaerat nobis quia.,Maximo,Sporer,rashad@stokes.io,CH,Argentina Durgan,Repudiandae laborum consequuntur alias itaque.,2022-03-26,2022-03-26 16:26:13 UTC
547,Aperiam voluptatem ut a rerum.,Courtney,Stokes,earlene@orn.info,CH,Malena Kutch,In autem molestias maxime.,2022-03-26,2022-03-26 16:26:13 UTC
548,Eveniet temporibus quasi sit assumenda.,Signe,Cole,clemente@heidenreich.com,CH,Jarod Hermiston,Fugit consequatur in provident vel vitae.,2022-03-26,2022-03-26 16:26:13 UTC
549,Vel autem voluptatibus laborum dicta beatae.,Kennith,Hilpert,claud@franecki.co,CH,Sherlyn Stracke DVM,Laboriosam nisi voluptate repudiandae possimus omnis.,2022-03-26,2022-03-26 16:26:13 UTC
558,Vitae qui veritatis vero in.,Chester,Ankunding,guadalupe.jacobson@klocko.org,CH,Mrs. Hugo Renner,Est tenetur animi nihil ut.,2022-03-26,2022-03-26 16:26:13 UTC
550,Aut id voluptatibus.,Fernando,Steuber,francesco.reichel@kovacek.com,CH,Wilfred Kassulke DDS,Optio nihil ut.,2022-03-26,2022-03-26 16:26:13 UTC
551,Molestias hic itaque eius impedit sunt.,Lilly,Ortiz,delena@kuvalis.info,CH,Hal Schuppe,Est error ipsa voluptatem ut.,2022-03-26,2022-03-26 16:26:13 UTC
552,Fugiat aliquid sed modi.,Briana,Steuber,dana_dibbert@russel.biz,CH,Arvilla Beatty,Quasi odio qui.,2022-03-26,2022-03-26 16:26:13 UTC
559,Sed praesentium similique et omnis id.,Xiomara,Turner,yadira@waelchi.info,CH,Merlin Reinger,Aut impedit fuga autem eum porro.,2022-03-26,2022-03-26 16:26:13 UTC
553,Dolorem maxime sed quibusdam.,Martin,Wiegand,asa@hermann.com,CH,Amb. Leida Kulas,Illum aut placeat culpa officia velit.,2022-03-26,2022-03-26 16:26:13 UTC
554,Iure quasi temporibus pariatur suscipit.,Cherly,Sawayn,deloise.littel@lindgren.io,CH,Dr. Harley Howell,Quo omnis cumque voluptatem illo.,2022-03-26,2022-03-26 16:26:13 UTC
564,Natus quas molestiae non quia dolorem.,Britt,D'Amore,charissa_denesik@grant.com,CH,Lamar Balistreri LLD,Quo illum veniam ut.,2022-03-26,2022-03-26 16:26:13 UTC
546,Et deserunt eum eum enim.,Jame,Funk,jerrell.breitenberg@shields.name,CH,Pres. Delora Bahringer,Necessitatibus magni aut expedita quam.,2022-03-26,2022-03-26 16:26:13 UTC
555,Et modi officia.,Allan,Hilll,emilio@conn-balistreri.org,CH,January Schumm,Ad iure temporibus.,2022-03-26,2022-03-26 16:26:13 UTC
560,Molestiae hic modi quia.,Crystle,Fritsch,rodney@kilback.net,CH,Natividad Thiel,Sunt nihil sit inventore laboriosam nemo.,2022-03-26,2022-03-26 16:26:13 UTC
556,Est eum odit.,Christian,Mills,oren.dietrich@heidenreich.co,CH,Miss Wendell Feeney,Dolor culpa velit.,2022-03-26,2022-03-26 16:26:13 UTC
561,Praesentium eos deserunt mollitia.,Rebbecca,Raynor,armando_watsica@wisoky.com,CH,Dr. Shamika Weber,Cum iusto magni.,2022-03-26,2022-03-26 16:26:13 UTC
565,Rerum et quasi tenetur.,Ned,D'Amore,weston@halvorson-cummerata.io,CH,Shaunte Marvin,Omnis quae consequuntur aut qui et.,2022-03-26,2022-03-26 16:26:13 UTC
562,Quia rem magnam sed.,Hobert,Will,emilio@cartwright.co,CH,Alberto Hand,Voluptates illum aliquam voluptatum totam corrupti.,2022-03-26,2022-03-26 16:26:13 UTC
563,Sequi porro et et.,Thomasina,Lind,genevive.runolfsdottir@volkman.io,CH,Augustine Will,Delectus totam odio excepturi.,2022-03-26,2022-03-26 16:26:13 UTC
