id,title,firstname,lastname,email,country,other_authors,comment,appearance_date,created_at
130,Quia tempora ab laudantium temporibus.,Tillie,Jerde,jody.kovacek@marvin.com,CH,Hans Roob III,Eveniet veniam sed consectetur minima soluta.,2022-03-25,2022-03-25 10:37:23 UTC
121,Ratione quia repellendus deleniti.,Ceola,Volkman,tad@cummings.biz,CH,Pres. Franklyn Bergnaum,Est minus dolorem ratione.,2022-03-25,2022-03-25 10:37:22 UTC
122,Eaque ex suscipit quam eligendi consectetur.,Dennise,Weber,carmen.johnson@spinka.biz,CH,Dominick Bernhard,Quia quaerat cum sed.,2022-03-25,2022-03-25 10:37:22 UTC
136,Aperiam placeat explicabo.,Neal,Cartwright,chiquita@reichel-beatty.net,CH,Aurelio Barton,Quia laudantium aspernatur.,2022-03-25,2022-03-25 10:37:23 UTC
123,Suscipit natus totam.,Tommie,Boyle,candis@wuckert.io,CH,Fidela Brekke,Et atque aut voluptas rem.,2022-03-25,2022-03-25 10:37:22 UTC
131,Aliquam aliquid accusantium at.,Candance,McDermott,glenn@robel-wolff.name,CH,Gail Kirlin,Esse vel soluta iusto quam corrupti.,2022-03-25,2022-03-25 10:37:23 UTC
124,Nihil et consectetur autem odio.,Gena,Legros,hyman@metz.info,CH,Rosette Abbott,Non sit ut.,2022-03-25,2022-03-25 10:37:22 UTC
125,Quia tempore ullam deleniti.,Ahmed,Hoeger,oliver_bechtelar@harvey.org,CH,Cecilia Cruickshank,Eligendi et perspiciatis laudantium neque.,2022-03-25,2022-03-25 10:37:22 UTC
126,Aliquam aut voluptates enim quis.,Boyd,West,tawana@sporer.org,CH,Lottie Feil,Corrupti nostrum aliquid in.,2022-03-25,2022-03-25 10:37:23 UTC
132,Hic ad libero est magni corrupti.,German,Feil,lucius@bruen-weimann.com,CH,Johnie Kautzer,Corrupti iste at sapiente.,2022-03-25,2022-03-25 10:37:23 UTC
127,Non error voluptatum.,Virgil,Hahn,johnie.schmeler@von-miller.io,CH,Sen. Ashlee Cormier,Nostrum vero sunt.,2022-03-25,2022-03-25 10:37:23 UTC
119,Eum nihil laborum.,Frank,Schulist,jere_hane@hayes-kuhic.co,CH,Ken Roberts IV,Adipisci accusamus itaque non.,2022-03-25,2022-03-25 10:37:22 UTC
128,Autem occaecati enim a.,Jannet,Labadie,booker_huels@oreilly.name,CH,Tobias Glover,Doloribus quo architecto molestiae consequatur et.,2022-03-25,2022-03-25 10:37:23 UTC
120,Quas fugiat ipsam est.,Colby,Waelchi,bernie@white.info,CH,Chadwick Langosh,Asperiores sed facere fugiat dolorem.,2022-03-25,2022-03-25 10:37:22 UTC
129,Sit vero esse.,Jacquiline,Jenkins,mathilde.treutel@carter.info,CH,Laurice Metz Esq.,Quisquam laudantium qui quo atque dolorem.,2022-03-25,2022-03-25 10:37:23 UTC
137,Ut dolor ipsam odio ea voluptas.,Wilburn,Wilderman,carlee@carroll.name,CH,Garth Russel,Quia fugiat cum dolores.,2022-03-25,2022-03-25 10:37:23 UTC
133,Ut ea ipsam.,Zulma,Mann,erich.ledner@walter.biz,CH,Amb. Newton Greenholt,Vel quo nihil tenetur expedita.,2022-03-25,2022-03-25 10:37:23 UTC
134,Sit accusantium quia labore hic in.,Genevieve,Padberg,preston@funk.info,CH,Twana Weissnat,Aut deleniti inventore.,2022-03-25,2022-03-25 10:37:23 UTC
135,Enim at quis fuga nihil debitis.,Roy,Leffler,terrence@smith.io,CH,Cruz Koepp DC,Qui voluptate a quis aperiam modi.,2022-03-25,2022-03-25 10:37:23 UTC
138,Est omnis culpa.,Elva,Heathcote,dwain.bradtke@west.net,CH,Kasie Cronin,Rerum repellendus officiis nihil ex.,2022-03-25,2022-03-25 10:37:23 UTC
