id,title,firstname,lastname,email,country,other_authors,comment,appearance_date,created_at
102,Numquam eum consequuntur explicabo magnam non.,Cathern,Murazik,maggie@schamberger.co,CH,Gov. Harley Von,Quaerat est fugiat quas debitis tempora.,2022-03-25,2022-03-25 10:37:19 UTC
103,Laborum et vel alias sequi.,Estella,Schaden,kenisha_bradtke@williamson.com,CH,Stanton Murray,Molestias voluptatum pariatur dolores soluta.,2022-03-25,2022-03-25 10:37:19 UTC
104,Ut ea unde atque ab.,Gregg,Heller,romeo.stokes@muller.net,CH,Kareem Nader,Et quos omnis.,2022-03-25,2022-03-25 10:37:19 UTC
111,Quia perferendis sed nesciunt eveniet aperiam.,Jamel,Gusikowski,kelle_mckenzie@stamm.name,CH,Laureen Keebler,Explicabo vel deleniti officia.,2022-03-25,2022-03-25 10:37:19 UTC
105,Nam et tenetur labore.,Alise,Tremblay,bettina.kunze@gusikowski.biz,CH,Marco Adams,Error molestias animi praesentium autem quas.,2022-03-25,2022-03-25 10:37:19 UTC
106,Excepturi harum vel.,Hipolito,Sawayn,chere.kunde@lehner-bernier.co,CH,Tera Cruickshank,Beatae veritatis qui.,2022-03-25,2022-03-25 10:37:19 UTC
99,Natus et sit nemo.,Janessa,Weissnat,sammy@miller.co,CH,Lorie Lang,Nostrum ab sed unde.,2022-03-25,2022-03-25 10:37:18 UTC
100,Voluptate sit deserunt error ut.,Jayme,Thompson,lindsey@gottlieb.biz,CH,Amb. Meri Hirthe,Incidunt deserunt velit.,2022-03-25,2022-03-25 10:37:18 UTC
107,Vero consequatur aperiam error nesciunt.,Mellisa,Bernhard,douglas_waelchi@jenkins-lakin.biz,CH,Thomasina Ullrich Sr.,Et molestiae quia ut rerum quo.,2022-03-25,2022-03-25 10:37:19 UTC
101,Sed debitis dolor sunt quo ipsam.,Sau,Gutkowski,allyn_nicolas@grimes.name,CH,Fe Champlin,Ea animi id consectetur.,2022-03-25,2022-03-25 10:37:19 UTC
112,Qui consequatur amet et accusantium.,Jordan,Kuhlman,dollie@windler.name,CH,Eldon Hammes II,Consequuntur excepturi totam et dolores.,2022-03-25,2022-03-25 10:37:19 UTC
108,Blanditiis placeat eius est aut.,Tory,Stoltenberg,osvaldo@goyette-hand.info,CH,Cliff Hoeger,Voluptatem ipsam qui.,2022-03-25,2022-03-25 10:37:19 UTC
117,Minus mollitia quidem.,Lewis,Lind,hyman@fritsch.io,CH,Kenny Mante,Quia doloremque aut voluptatem corrupti.,2022-03-25,2022-03-25 10:37:19 UTC
109,Odit consequuntur quae qui est necessitatibus.,Timothy,Luettgen,frankie@mcglynn-kuhn.com,CH,Malcolm Barton Ret.,Et non voluptatem quia omnis.,2022-03-25,2022-03-25 10:37:19 UTC
113,Vitae dolores enim ea.,Collette,Schneider,miesha@nikolaus-schamberger.net,CH,Sandie Hansen,Incidunt sunt ullam.,2022-03-25,2022-03-25 10:37:19 UTC
110,Quidem necessitatibus ut aut labore.,Calvin,Bergstrom,carrie@auer.info,CH,Julio Keeling Ret.,Quia est dolorem eveniet repellendus.,2022-03-25,2022-03-25 10:37:19 UTC
114,Temporibus natus ullam eveniet dolorem quidem.,Deon,Hayes,isaias@rice.net,CH,Winston Balistreri,Quam modi ut perspiciatis.,2022-03-25,2022-03-25 10:37:19 UTC
115,Labore facilis qui nobis quaerat saepe.,Nolan,Stiedemann,lucio_reinger@daugherty-brekke.info,CH,Bess Rowe PhD,Optio minima dicta qui culpa.,2022-03-25,2022-03-25 10:37:19 UTC
118,Qui assumenda voluptates nulla deleniti eius.,Douglas,Mueller,normand_hermiston@schultz.org,CH,Son DuBuque,Doloribus ipsum temporibus sint quas ut.,2022-03-25,2022-03-25 10:37:19 UTC
116,Unde commodi ullam.,Myesha,Altenwerth,lucy_brekke@goldner.io,CH,Marc Denesik,Tempora maxime ad velit veritatis quisquam.,2022-03-25,2022-03-25 10:37:19 UTC
