id,title,firstname,lastname,email,country,other_authors,comment,appearance_date,created_at
811,Est sed voluptatum quisquam minima.,Fredia,Fadel,annabel@schaefer-leannon.com,CH,Santo Cole,Sed facilis qui velit cum saepe.,2022-04-29,2022-04-29 13:24:06 UTC
820,Sunt nulla enim qui mollitia pariatur.,Aubrey,Barton,althea.feil@howell-wiegand.co,CH,Irving MacGyver,Maxime vitae eum fugit repellendus.,2022-04-29,2022-04-29 13:24:07 UTC
812,Nulla impedit quis est expedita.,Kip,Greenfelder,landon.homenick@gottlieb-brakus.co,CH,Ivan Braun,Sed debitis ea ad ratione aliquid.,2022-04-29,2022-04-29 13:24:07 UTC
813,Aut in odit ad.,Leslee,Graham,alphonso@wolff.org,CH,Penni Weimann,Nemo nam et.,2022-04-29,2022-04-29 13:24:07 UTC
826,Nihil quia reprehenderit nihil impedit cum.,Ramon,McGlynn,fidel.stehr@upton-windler.name,CH,Elroy Jaskolski,Amet illum sequi possimus nam.,2022-04-29,2022-04-29 13:24:07 UTC
814,Harum aut ut.,Cliff,McLaughlin,roberto_stoltenberg@white.com,CH,Rep. Estelle Reichel,Aliquam natus iste ratione.,2022-04-29,2022-04-29 13:24:07 UTC
821,Nesciunt sint sint iste rerum.,Trudi,Marquardt,robyn_kiehn@hane.info,CH,Laurene West,Repudiandae excepturi ipsa sapiente maxime at.,2022-04-29,2022-04-29 13:24:07 UTC
807,Vel dicta ut dolores aut.,Iva,Auer,scot.krajcik@jaskolski-bahringer.co,CH,Angelo Lynch I,Repellendus eaque est dignissimos molestias.,2022-04-29,2022-04-29 13:24:06 UTC
815,Dolorum blanditiis animi nemo tempore.,Angela,Lemke,malcolm@ullrich-batz.biz,CH,Antonio Marks,Quis repellat omnis repellendus sint.,2022-04-29,2022-04-29 13:24:07 UTC
808,Necessitatibus vel praesentium aperiam nemo.,Ronald,Bechtelar,alfredia@beatty.name,CH,Danette Fay,Ipsam eveniet voluptas omnis magnam.,2022-04-29,2022-04-29 13:24:06 UTC
809,Sapiente facere dolorum ut soluta modi.,Edmund,McLaughlin,ray.hagenes@rath.com,CH,Regina Crooks,Eos tempora neque illo debitis repellendus.,2022-04-29,2022-04-29 13:24:06 UTC
816,Ipsa mollitia voluptatum.,Dominick,Steuber,isiah@parisian.org,CH,Wilburn Halvorson,Fuga deleniti autem soluta facere repellendus.,2022-04-29,2022-04-29 13:24:07 UTC
810,Quis a necessitatibus facere labore.,Becky,Ernser,rosalba_wilderman@ledner.info,CH,Laveta Jaskolski,Sit praesentium accusantium quae itaque.,2022-04-29,2022-04-29 13:24:06 UTC
817,Blanditiis ea fugiat.,Loreta,Johns,cathern@wuckert-lynch.info,CH,Rodrick Cassin,Mollitia sit occaecati molestiae ut dolorem.,2022-04-29,2022-04-29 13:24:07 UTC
822,Repellat minima quia ipsa in.,Stan,Powlowski,louie@ryan-mitchell.name,CH,Judson Bernier,Alias sunt animi.,2022-04-29,2022-04-29 13:24:07 UTC
818,Eaque dolor et eum similique amet.,Clifford,Reichel,dean@cormier-dach.io,CH,Will Keebler,Quasi non qui.,2022-04-29,2022-04-29 13:24:07 UTC
819,Neque unde quis accusamus et reprehenderit.,Laticia,Lebsack,kermit_champlin@altenwerth-flatley.info,CH,Fr. Penny Koch,Excepturi sit corrupti aspernatur et.,2022-04-29,2022-04-29 13:24:07 UTC
823,Non consectetur nihil placeat nobis.,Cheri,Gutkowski,ted_torp@hirthe-osinski.org,CH,Yun Collier,Qui quia repellat.,2022-04-29,2022-04-29 13:24:07 UTC
824,Hic distinctio neque dolorem ratione.,Candace,Sipes,miquel@jakubowski.net,CH,Herb Feil Sr.,Sunt veniam sit quas dolorem quo.,2022-04-29,2022-04-29 13:24:07 UTC
825,Non maiores ut dignissimos earum voluptas.,Scott,Sawayn,janette@mckenzie.co,CH,Eleanore Hilpert,Et quia qui ab.,2022-04-29,2022-04-29 13:24:07 UTC
