id,title,firstname,lastname,email,country,other_authors,comment,appearance_date,created_at
11,Animi facilis consequuntur ea dolor.,Jed,Mante,riley@kuhic.name,CH,The Hon. Emmanuel Larkin,Dicta aspernatur qui voluptatum quo enim.,2022-01-24,2022-01-24 07:07:17 UTC
21,Voluptas neque quibusdam aut.,Columbus,Lubowitz,ruth@harris-pagac.name,CH,Glenn Moen,Perspiciatis alias nulla est fuga.,2022-01-24,2022-01-24 07:07:18 UTC
12,Ea nulla voluptatem dolores accusamus.,Maximo,Pollich,marlin@cruickshank-murazik.biz,CH,Fr. Dominga McDermott,Cumque assumenda illo et iusto.,2022-01-24,2022-01-24 07:07:17 UTC
13,Sed consectetur laboriosam repudiandae officia.,Rachelle,Reilly,mason_blick@mayert-kautzer.name,CH,Izola Hilll,Suscipit in sit quia.,2022-01-24,2022-01-24 07:07:17 UTC
14,Fuga quis tempore impedit.,Glinda,Krajcik,cristie_damore@klein.com,CH,Kaleigh Bosco,Et expedita sit dolor in non.,2022-01-24,2022-01-24 07:07:17 UTC
22,Nam ullam totam repellat qui.,Delmar,Koepp,aretha@marvin.org,CH,Delmer Parisian V,Sint asperiores necessitatibus qui dolor.,2022-01-24,2022-01-24 07:07:18 UTC
15,Labore fugiat rerum numquam.,Ralph,King,antonio_schneider@mayert.io,CH,Merrill Prohaska DO,Occaecati non quia velit et eaque.,2022-01-24,2022-01-24 07:07:17 UTC
16,Nemo inventore rerum culpa laborum.,Alvin,Altenwerth,abram.haag@hermiston-schroeder.net,CH,Lottie Green,Blanditiis illo necessitatibus dignissimos.,2022-01-24,2022-01-24 07:07:17 UTC
28,Magnam adipisci rem.,Henry,Steuber,rashida_boyle@hettinger.co,CH,Madlyn Nienow,Ab sed numquam.,2022-01-24,2022-01-24 07:07:18 UTC
17,Dolores qui est id qui.,Yuk,Dicki,robyn@boyer.com,CH,Voncile Willms,Debitis voluptas voluptas.,2022-01-24,2022-01-24 07:07:18 UTC
9,Quibusdam consequatur aut.,Mason,Haley,raymond_schumm@mclaughlin-collier.com,CH,Tod Von,Recusandae animi iste atque rem molestiae.,2022-01-24,2022-01-24 07:07:17 UTC
23,Aut incidunt sapiente deserunt cum.,Chris,Cronin,jae@will.net,CH,Michel Gutmann,Atque quo ratione.,2022-01-24,2022-01-24 07:07:18 UTC
10,Ipsa consectetur nostrum ad voluptatem.,Bennie,Hyatt,ahmad_schimmel@stark-runte.com,CH,Dannie Bosco VM,Assumenda nesciunt enim itaque ut aut.,2022-01-24,2022-01-24 07:07:17 UTC
18,Dolores sit libero repellendus praesentium.,Dominick,Hackett,wilburn@conn.info,CH,Burl Torp MD,Temporibus qui eius aut.,2022-01-24,2022-01-24 07:07:18 UTC
19,Quia labore illo aut.,Chet,Ratke,theola@effertz-leuschke.co,CH,Chauncey Armstrong,Repellat nam earum qui.,2022-01-24,2022-01-24 07:07:18 UTC
24,Et ea non quia nisi.,Darryl,Abbott,chelsea@block.com,CH,Angelena Bashirian,Cumque tempora sunt est non.,2022-01-24,2022-01-24 07:07:18 UTC
20,Modi sit architecto.,Deedra,Marks,tim.yundt@spinka.org,CH,Diane Hamill,Et corrupti voluptatibus ab aut.,2022-01-24,2022-01-24 07:07:18 UTC
25,Explicabo dicta voluptas voluptatem doloremque.,Royal,Bergstrom,fermin@mohr-huel.biz,CH,Jordan Mayert,Laudantium et nihil a consequatur et.,2022-01-24,2022-01-24 07:07:18 UTC
26,Non ex aut magnam est nam.,Zackary,Stark,jean_ernser@price.io,CH,The Hon. Gala Emard,Nobis quae placeat.,2022-01-24,2022-01-24 07:07:18 UTC
27,Soluta culpa qui voluptas quia cupiditate.,Elmer,Erdman,huey_yost@hayes.name,CH,Carmelo Cruickshank,Corrupti quasi quisquam.,2022-01-24,2022-01-24 07:07:18 UTC
