id,title,firstname,lastname,email,country,other_authors,comment,appearance_date,created_at
281,Qui ut aut illo.,Tommy,Gleason,ben@bergnaum.net,CH,Rep. Wes Wisozk,Quasi corporis fugiat.,2022-08-19,2022-08-19 19:23:05 UTC
282,Et saepe porro.,Ramiro,Parisian,delmer.hayes@mcglynn.org,CH,Amb. Stephanie Sporer,Dolores doloremque consequuntur fugit dicta.,2022-08-19,2022-08-19 19:23:05 UTC
283,Inventore itaque autem quia.,Jimmie,Gulgowski,le_abernathy@waters.biz,CH,Frankie Kautzer,Nobis provident pariatur blanditiis.,2022-08-19,2022-08-19 19:23:05 UTC
288,Quis et magni vitae dolor sint.,Laci,Fritsch,sharie@fahey.io,CH,Andrea Satterfield,Velit ad dolores et aut dolore.,2022-08-19,2022-08-19 19:23:05 UTC
284,Officia et distinctio.,Lucille,Boehm,samual@doyle.org,CH,Otto King,Labore id vitae.,2022-08-19,2022-08-19 19:23:05 UTC
285,Asperiores est numquam.,Frank,Tillman,deonna_hirthe@ferry.net,CH,Sen. Duane Lakin,Aliquam sit blanditiis.,2022-08-19,2022-08-19 19:23:05 UTC
292,Eum vero at dolor.,Shantelle,Greenfelder,adolfo.schumm@robel.org,CH,Cara Hills,Sed odit neque qui.,2022-08-19,2022-08-19 19:23:05 UTC
280,Quas quam quos totam laudantium id.,Marjorie,Corkery,joel@schmitt-oreilly.co,CH,Deloris Block Ret.,Id ut quia sed reiciendis voluptas.,2022-08-19,2022-08-19 19:23:05 UTC
289,Quia in enim autem ut nihil.,Catrice,Boehm,johnny@goyette.info,CH,Jacqui Nicolas,Aliquam laboriosam sint vero tempora harum.,2022-08-19,2022-08-19 19:23:05 UTC
286,Quia porro corrupti.,Gaylene,Ryan,cherryl@orn-smith.net,CH,Msgr. Latricia Champlin,Est molestias rerum culpa aut.,2022-08-19,2022-08-19 19:23:05 UTC
287,Reprehenderit voluptatibus tempore non magni alias.,Vern,Hegmann,caroll@heathcote.info,CH,The Hon. Leroy Wunsch,Culpa adipisci nihil qui nisi.,2022-08-19,2022-08-19 19:23:05 UTC
290,Accusamus et rerum aut tenetur tempora.,Selina,Bartell,ladonna_batz@ruecker.net,CH,Reena O'Conner,Aliquid et ex harum quis dolores.,2022-08-19,2022-08-19 19:23:05 UTC
296,Enim ad id rerum magnam.,Lashunda,Orn,barton@mann.biz,CH,The Hon. Joesph Wilderman,Tempora aut rem dolores.,2022-08-19,2022-08-19 19:23:05 UTC
291,Ipsa beatae et repudiandae.,Gerry,Schaefer,cornelius@cormier.org,CH,Erasmo Lemke DC,Cupiditate voluptatum explicabo.,2022-08-19,2022-08-19 19:23:05 UTC
293,Magni ducimus laudantium ut non.,Garrett,Stokes,abe@cormier.info,CH,Franklyn Hessel,Rem voluptatibus voluptatem id.,2022-08-19,2022-08-19 19:23:05 UTC
295,Cumque deleniti exercitationem.,Barney,Schaden,jerlene@schaden-breitenberg.name,CH,Isaiah Sipes,Voluptatem consequatur doloribus temporibus repellat est.,2022-08-19,2022-08-19 19:23:05 UTC
294,Aperiam aut mollitia consectetur in modi.,Olen,Heaney,augusta.braun@miller-spencer.info,CH,Jenine McGlynn VM,Harum magnam nulla sit.,2022-08-19,2022-08-19 19:23:05 UTC
297,Laborum doloremque sunt at.,Winter,Pollich,anderson@predovic-jast.net,CH,Marc Borer,Vel atque voluptas fuga.,2022-08-19,2022-08-19 19:23:05 UTC
298,Ut rerum nobis.,Dominique,Bogan,kendra@rutherford.co,CH,Mitch Torp DDS,Odio ipsa repellat enim placeat ut.,2022-08-19,2022-08-19 19:23:05 UTC
299,Inventore totam cum.,Craig,Conn,dick_schowalter@okon.com,CH,Chris Gleichner Jr.,Veritatis voluptatem repellendus dolorum.,2022-08-19,2022-08-19 19:23:05 UTC
