id,title,firstname,lastname,email,country,other_authors,comment,appearance_date,created_at
300,Earum veniam mollitia provident sit.,Raven,Moen,lavern@luettgen-leffler.net,CH,Russel McCullough,Laborum minus quos.,2022-05-06,2022-05-06 12:22:28 UTC
292,Minus eos rerum velit dicta.,Eugene,Johns,mauro@williamson-larson.info,CH,Freeman Schuster,Aperiam soluta id minus aut.,2022-05-06,2022-05-06 12:22:27 UTC
293,Porro in quas eius amet.,Caitlin,Metz,viva@hintz.name,CH,Josphine Stracke,Fuga numquam ratione non dolor enim.,2022-05-06,2022-05-06 12:22:27 UTC
294,Sit ipsum ut autem autem cupiditate.,Milly,Bruen,graig_corkery@macgyver.co,CH,Enoch Hegmann,Et voluptatem qui.,2022-05-06,2022-05-06 12:22:27 UTC
301,Molestiae quo unde fugiat debitis rerum.,Waldo,O'Kon,phoebe@yundt.io,CH,Amb. Martine Schuppe,Est blanditiis quibusdam.,2022-05-06,2022-05-06 12:22:28 UTC
295,Qui accusamus qui officia voluptatem.,Wilton,Sauer,guadalupe.braun@kirlin.org,CH,Olen Ortiz,Voluptates mollitia est vero eveniet.,2022-05-06,2022-05-06 12:22:28 UTC
288,Dolore dolorum qui et.,Brenton,Runolfsdottir,myles@kertzmann.io,CH,Phillip Jones,Qui esse molestiae quis.,2022-05-06,2022-05-06 12:22:27 UTC
296,Impedit tempore aperiam corporis mollitia.,Caryn,Romaguera,vennie_littel@kerluke.net,CH,Pres. Mark Reinger,Omnis soluta aliquam ut voluptatem recusandae.,2022-05-06,2022-05-06 12:22:28 UTC
289,Autem eum iusto officiis.,Christine,Lang,rhiannon.goodwin@keebler.biz,CH,Ossie Metz,Qui impedit ut consequuntur.,2022-05-06,2022-05-06 12:22:27 UTC
290,Exercitationem beatae nulla qui et impedit.,Bernie,Yundt,albertha.ratke@bednar.io,CH,Troy Volkman,Consectetur vel rerum rerum deleniti.,2022-05-06,2022-05-06 12:22:27 UTC
291,Deserunt qui iure ullam ut quaerat.,Clifton,Predovic,karon.will@kiehn.net,CH,Deedee Nolan,Illo recusandae architecto.,2022-05-06,2022-05-06 12:22:27 UTC
297,Officia aut hic ut similique.,Moon,Prosacco,lelia_ferry@lindgren-ondricka.org,CH,Janel Wolf,Aut atque officiis rerum laborum.,2022-05-06,2022-05-06 12:22:28 UTC
302,Quis laboriosam et.,Porfirio,Kuhic,elden_schaden@romaguera.name,CH,Lanny Fritsch,Unde rerum enim architecto necessitatibus rerum.,2022-05-06,2022-05-06 12:22:29 UTC
298,Fugiat et et.,Jarred,Stanton,brian@lehner-renner.io,CH,Alysa Parisian,Voluptatem iusto neque est.,2022-05-06,2022-05-06 12:22:28 UTC
299,Minus blanditiis asperiores.,Terese,Roob,mitzi@beahan.name,CH,Ethan Zieme,Voluptas beatae assumenda ex natus autem.,2022-05-06,2022-05-06 12:22:28 UTC
306,Rerum est eaque animi expedita.,Chuck,White,alpha@farrell-krajcik.io,CH,Brooks Berge,Beatae vitae autem.,2022-05-06,2022-05-06 12:22:29 UTC
303,Ea eum ex.,Wyatt,Farrell,damien_huel@kling-torphy.net,CH,Anthony Ferry Ret.,Ut et eligendi.,2022-05-06,2022-05-06 12:22:29 UTC
304,Sequi harum non necessitatibus.,Jarrett,Hagenes,mary@pacocha-orn.net,CH,Maritza Watsica,Qui at ex accusantium esse praesentium.,2022-05-06,2022-05-06 12:22:29 UTC
307,Cupiditate fuga sit.,Marti,Weber,ching.walsh@carroll.info,CH,Bridget Stracke,Aut alias dignissimos.,2022-05-06,2022-05-06 12:22:29 UTC
305,Eligendi et qui atque corporis.,Carissa,Mohr,ambrose_dibbert@goodwin.co,CH,Owen Brown,Saepe odio exercitationem hic.,2022-05-06,2022-05-06 12:22:29 UTC
