id,title,firstname,lastname,email,country,other_authors,comment,appearance_date,created_at
774,Quia aut beatae ut.,Greg,Reichel,kyla_anderson@bailey.name,CH,Ernest Anderson Jr.,Ad tempora fugiat dolor.,2022-04-29,2022-04-29 13:16:06 UTC
766,Aperiam velit libero.,Gayle,Herzog,marlene.renner@klocko.com,CH,Jeannetta Bosco,Quia nostrum incidunt omnis dolores.,2022-04-29,2022-04-29 13:16:05 UTC
767,Vero repudiandae nihil.,Wilson,McDermott,kortney.ledner@hane-ritchie.io,CH,Hermina Welch,Temporibus et qui repudiandae.,2022-04-29,2022-04-29 13:16:05 UTC
768,Et reiciendis autem quo quam.,Joslyn,Daniel,scot.hermann@considine.co,CH,Mr. Missy Feest,Necessitatibus dolores qui error velit quaerat.,2022-04-29,2022-04-29 13:16:06 UTC
775,Hic reprehenderit distinctio.,Cyrstal,Weimann,arron@dubuque.co,CH,Sydney Ritchie,Saepe totam expedita quasi.,2022-04-29,2022-04-29 13:16:06 UTC
769,Accusantium modi nobis expedita necessitatibus.,Dewitt,Gleichner,cris.fadel@weimann.biz,CH,Yolande Kris,Laboriosam quibusdam libero.,2022-04-29,2022-04-29 13:16:06 UTC
761,Placeat et ducimus distinctio.,Christopher,Flatley,cassondra@larson.co,CH,Msgr. Kiyoko Huel,Corporis delectus veniam tempora ipsum consequatur.,2022-04-29,2022-04-29 13:16:05 UTC
762,Unde illum et at veritatis quam.,Shanice,Bechtelar,sheree_walker@hermann-kilback.biz,CH,Houston Anderson,Est harum dolor enim aut.,2022-04-29,2022-04-29 13:16:05 UTC
763,Nulla aliquam dolorum voluptate dignissimos.,Cheyenne,Upton,don@johnson-dietrich.name,CH,Jeremy Emmerich,Perferendis placeat ut et blanditiis magnam.,2022-04-29,2022-04-29 13:16:05 UTC
770,Illo laborum asperiores.,Elenor,Konopelski,delaine@hoppe.info,CH,Fr. Jocelyn Littel,Esse atque aliquid vel velit.,2022-04-29,2022-04-29 13:16:06 UTC
764,Ea repellendus autem.,Lee,Hills,antone@ebert.org,CH,Lottie Mayer,Sed numquam sed eum blanditiis.,2022-04-29,2022-04-29 13:16:05 UTC
765,Optio autem beatae asperiores quod.,Lenard,Cassin,rolando.lueilwitz@dicki.io,CH,Venice Crooks,Id maiores corporis laudantium dolores.,2022-04-29,2022-04-29 13:16:05 UTC
771,Consequatur dolores non esse voluptates modi.,Carey,Hamill,marcy@stiedemann.name,CH,Al Cassin,Et aut cum alias incidunt.,2022-04-29,2022-04-29 13:16:06 UTC
776,Quaerat deleniti temporibus.,Cheryle,Gottlieb,heide@crist.io,CH,Caterina Armstrong,Et eius necessitatibus consequatur eos voluptatum.,2022-04-29,2022-04-29 13:16:06 UTC
772,Ut in sed labore rerum est.,Carl,Ruecker,venus@raynor.io,CH,Yuriko Ryan,Assumenda quo rerum quia.,2022-04-29,2022-04-29 13:16:06 UTC
773,Qui omnis quia quia in.,Ashley,Parisian,jacquelyne.fahey@barrows.io,CH,Amb. Shaun Welch,Nostrum ut rem quam.,2022-04-29,2022-04-29 13:16:06 UTC
780,Quas recusandae possimus ut doloremque iste.,Maybell,Bogisich,isabel@braun.com,CH,Roselia Wyman LLD,Ea voluptatem fugiat rerum eos.,2022-04-29,2022-04-29 13:16:06 UTC
777,Expedita aspernatur debitis iure.,Marcel,Gulgowski,alonzo.jaskolski@collins-okeefe.biz,CH,Msgr. Judson Considine,Ducimus id vero facere.,2022-04-29,2022-04-29 13:16:06 UTC
778,Et architecto dolorem iusto quia ipsa.,Zane,Moore,shawn.sanford@hills-gerhold.name,CH,Nathaniel Mraz,Repellendus earum quia exercitationem.,2022-04-29,2022-04-29 13:16:06 UTC
779,Porro saepe perspiciatis.,Lou,Hermann,vicky.daugherty@kris.io,CH,Loree Marks,Ipsa ut veniam.,2022-04-29,2022-04-29 13:16:06 UTC
