id,title,firstname,lastname,email,country,other_authors,comment,appearance_date,created_at
260,Laudantium rerum delectus odio.,Mirta,Rau,jeffery@cole.io,CH,Dr. Mose Brekke,Illo doloribus earum reiciendis.,2022-04-30,2022-04-30 18:46:41 UTC
246,Voluptatibus aut rerum aut quos.,Patria,Nolan,loraine_schimmel@swift.name,CH,Spencer Spinka,Odio repudiandae tempore fuga.,2022-04-30,2022-04-30 18:46:40 UTC
255,Aliquid consequuntur vitae corrupti dolore.,Jeannie,Miller,lacy_kulas@braun.co,CH,Ardis Bradtke,Qui dolorum nemo aut.,2022-04-30,2022-04-30 18:46:41 UTC
247,Rerum eos minima.,Erick,Langworth,angelina@labadie.io,CH,Columbus Macejkovic,Eius et facilis.,2022-04-30,2022-04-30 18:46:40 UTC
248,Maxime voluptatibus id nostrum.,Jarod,Lind,houston@marks.co,CH,Hollis Hilpert,Rerum aut quod cum.,2022-04-30,2022-04-30 18:46:40 UTC
249,Illum magni et.,Denny,Kessler,monte@armstrong.biz,CH,Alease Hermiston Ret.,Ut eum at enim qui officiis.,2022-04-30,2022-04-30 18:46:40 UTC
256,Dolore sunt amet maxime sapiente ut.,Racquel,Runolfsson,dusty_lowe@casper-fay.info,CH,Miguel Ankunding,Aut nisi tempore magni dicta dolores.,2022-04-30,2022-04-30 18:46:41 UTC
242,Aut voluptate voluptatem unde.,Hoyt,Kautzer,ngoc@conroy.io,CH,Thanh Jones,Aut architecto commodi voluptatem.,2022-04-30,2022-04-30 18:46:40 UTC
250,Delectus repellat quae.,Claud,Von,ramon@cassin.info,CH,Anibal Runolfsdottir,Placeat doloremque sequi molestiae.,2022-04-30,2022-04-30 18:46:41 UTC
243,Doloribus voluptate eius consequuntur.,Malik,Denesik,emerson@renner.io,CH,Felicitas Batz CPA,Sit voluptatibus hic.,2022-04-30,2022-04-30 18:46:40 UTC
244,Nulla quod consequatur ut cumque.,Nida,Swift,king_roob@turcotte-kemmer.io,CH,Luis Tremblay,Ipsam quo quisquam.,2022-04-30,2022-04-30 18:46:40 UTC
245,A quod quae aspernatur nisi.,Kirstie,Maggio,reinaldo@schulist.info,CH,Janina Sauer,Aut quis aut et nulla.,2022-04-30,2022-04-30 18:46:40 UTC
251,Voluptates quaerat ullam autem.,Loura,Buckridge,darrel@douglas.info,CH,Krysta Glover,Qui aut sit.,2022-04-30,2022-04-30 18:46:41 UTC
252,Qui dolore quo sequi maxime.,Belia,Morissette,joelle.wyman@runte.biz,CH,Damion Effertz,Quo esse est et.,2022-04-30,2022-04-30 18:46:41 UTC
257,Occaecati laborum sed tenetur eos enim.,Ashly,Kshlerin,douglas@jones.com,CH,Lester Weissnat,Fugit aliquid nam.,2022-04-30,2022-04-30 18:46:41 UTC
253,Eligendi hic deleniti quos consequatur.,Bernard,Pacocha,gayle@turner.io,CH,Deann Berge,Esse eos aliquid.,2022-04-30,2022-04-30 18:46:41 UTC
254,Voluptatum deserunt qui.,Aaron,Harber,kattie_dicki@dubuque.io,CH,Prince Gutkowski,Ab veritatis incidunt ut.,2022-04-30,2022-04-30 18:46:41 UTC
261,Laboriosam aut quisquam quas rerum omnis.,Eusebio,Hilpert,russ_roberts@auer-romaguera.info,CH,Shakita Abbott,Placeat veritatis distinctio ut.,2022-04-30,2022-04-30 18:46:41 UTC
258,Natus fuga asperiores omnis corporis sed.,Gerry,Jacobi,dannie@reichert-williamson.org,CH,Evangelina Mosciski,Qui accusantium et.,2022-04-30,2022-04-30 18:46:41 UTC
259,Quia perspiciatis quasi veritatis numquam impedit.,Stanford,Gulgowski,cari@kiehn-koch.io,CH,Marva Metz,Est harum minima doloremque laboriosam.,2022-04-30,2022-04-30 18:46:41 UTC
