id,title,firstname,lastname,email,country,other_authors,comment,appearance_date,created_at
1609,Quia et officiis consequatur cupiditate praesentium.,Shanti,Kohler,chi@hoeger.biz,CH,Yasuko Stracke,Mollitia ut eos temporibus similique maxime.,2021-10-25,2021-10-25 15:06:51 UTC
1617,Illo sint ab et magnam distinctio.,Tanner,Thompson,pat@gleichner.io,CH,Roberto Wunsch,Voluptate aliquid voluptatibus delectus modi in.,2021-10-25,2021-10-25 15:06:51 UTC
1610,Nulla quae suscipit esse dolor ut.,Bryan,Welch,isaiah@farrell-crona.info,CH,Corrie Emard DDS,Ipsam rerum voluptatem amet consequatur.,2021-10-25,2021-10-25 15:06:51 UTC
1602,Sit distinctio deserunt voluptatem est mollitia.,Erik,Batz,lonnie.ondricka@herzog.net,CH,Joya Lind DO,Quia illo modi et.,2021-10-25,2021-10-25 15:06:51 UTC
1611,Hic quod sed iste quae.,Carrol,Borer,twyla.krajcik@thompson.co,CH,Jordon Trantow,Corporis velit qui saepe dignissimos minima.,2021-10-25,2021-10-25 15:06:51 UTC
1603,Architecto non unde et porro.,Lashandra,Boehm,rosella_white@spinka-abshire.org,CH,Corrina Bernier,Non provident itaque voluptatem.,2021-10-25,2021-10-25 15:06:51 UTC
1604,Voluptatibus id sapiente fuga et.,Wayne,Parker,nigel@blanda-beatty.biz,CH,Dr. Branden Johnston,Est qui eum voluptatem excepturi nostrum.,2021-10-25,2021-10-25 15:06:51 UTC
1605,Inventore ex perferendis ipsam iure.,Charley,Hane,katharina_rath@welch-kreiger.co,CH,Mathew Collier,Nulla dolores architecto itaque quas.,2021-10-25,2021-10-25 15:06:51 UTC
1612,Et veritatis nihil corporis.,Mary,Luettgen,kristy.morissette@osinski.io,CH,Richie Lindgren,Voluptates veritatis modi id accusantium.,2021-10-25,2021-10-25 15:06:51 UTC
1606,Fuga eos rem suscipit voluptas.,Manual,Beer,renato@watsica-labadie.biz,CH,The Hon. Merri Halvorson,Odit in explicabo totam assumenda neque.,2021-10-25,2021-10-25 15:06:51 UTC
1607,Accusantium dignissimos repellat totam architecto et.,Odessa,Halvorson,milan.sporer@lebsack-cassin.info,CH,Rep. Otis Macejkovic,Enim quo harum.,2021-10-25,2021-10-25 15:06:51 UTC
1618,Doloremque occaecati quaerat.,Malinda,Beatty,ignacio@wisozk.com,CH,Prof. Billy Johnston,Qui autem temporibus quos.,2021-10-25,2021-10-25 15:06:51 UTC
1608,Atque earum aspernatur vel velit.,Elenora,Schmitt,philip.gottlieb@lowe-gleason.co,CH,Elmer Willms,Atque quidem voluptas.,2021-10-25,2021-10-25 15:06:51 UTC
1613,Qui vel eum.,Denna,Nikolaus,mitchell.strosin@strosin.com,CH,Cary Mann,Molestias quam odio iure perferendis magnam.,2021-10-25,2021-10-25 15:06:51 UTC
1614,Voluptatem vel dolores.,Abraham,Kessler,tresa.hayes@trantow.info,CH,Pres. Cindy Bode,Dolores ipsum in minima.,2021-10-25,2021-10-25 15:06:51 UTC
1615,Id doloremque distinctio est.,Alise,Hodkiewicz,soledad.crooks@hickle.com,CH,Ella Roberts,Sit natus adipisci rerum et.,2021-10-25,2021-10-25 15:06:51 UTC
1619,Et dolore fugiat unde recusandae.,Luciano,Beahan,austin.robel@wintheiser-mann.io,CH,Rep. Trish Herzog,Dolorem optio aspernatur amet.,2021-10-25,2021-10-25 15:06:51 UTC
1616,Vel tenetur harum velit voluptate et.,Librada,Rippin,henrietta_hessel@lakin.net,CH,Douglass Lakin,Aspernatur voluptatem voluptatum quo nam.,2021-10-25,2021-10-25 15:06:51 UTC
1620,Facere dolorum iusto.,Bobbi,Robel,susannah@mckenzie-wunsch.com,CH,Prof. Zena Kiehn,Suscipit provident itaque quo doloribus.,2021-10-25,2021-10-25 15:06:51 UTC
1621,Pariatur minima reiciendis.,Eden,Nicolas,keneth@parisian.biz,CH,Myrta Connelly,Dolor sed blanditiis porro veniam voluptatum.,2021-10-25,2021-10-25 15:06:51 UTC
